Question,Answer
"What challenges exist in studying Wolf 1061 c?","Challenges include its distance and the faintness of Wolf 1061, which complicates observations."
"What is the geological activity of Wolf 1061 c?","The geological activity of Wolf 1061 c is largely speculative and not well understood."
"What is the age of Wolf 1061?","Wolf 1061 is estimated to be around 4.4 billion years old."
"Does Wolf 1061 c experience seasons?","If Wolf 1061 c has an axial tilt, it may experience seasonal variations, but this is speculative."
"What is the primary energy source for Wolf 1061 c?","The primary energy source for Wolf 1061 c is the radiation from its host star, Wolf 1061."
"What are the potential biosignatures to look for on Wolf 1061 c?","Potential biosignatures include gases like oxygen, methane, and other indicators of biological processes."
"What challenges do astronomers face in characterizing Wolf 1061 c?","Challenges include its distance, the faintness of Wolf 1061, and limited observational data."
"What types of exoplanets are similar to Wolf 1061 c?","Similar exoplanets include other super-Earths located in the habitable zones of red dwarf stars."
"How does the mass of Wolf 1061 c influence its potential habitability?","A larger mass may influence geological activity and the ability to retain an atmosphere."
"What are the potential impacts of stellar flares on Wolf 1061 c's atmosphere?","Stellar flares could strip away the atmosphere over time, affecting habitability."
"How might future missions study Wolf 1061 c?","Future missions could use transit photometry and direct imaging to gather data on Wolf 1061 c."
"What is the likelihood of finding water vapor on Wolf 1061 c?","If Wolf 1061 c has a suitable atmosphere, there is a chance of detecting water vapor."
"What are the potential tectonic activities on Wolf 1061 c?","The potential for tectonic activity on Wolf 1061 c is uncertain and would require more data."
"How does Wolf 1061's luminosity affect Wolf 1061 c?","The lower luminosity of Wolf 1061 allows Wolf 1061 c to remain in the habitable zone at a closer distance."
"What is the significance of the Wolf 1061 system for astrobiology?","The Wolf 1061 system is significant for astrobiology due to its potential habitable planets."
"How might the atmosphere of Wolf 1061 c affect surface conditions?","The atmosphere of Wolf 1061 c could regulate temperatures and influence weather patterns."
"What is the best time to observe Wolf 1061 c from Earth?","The best time to observe Wolf 1061 c is when Wolf 1061 is prominently visible in the night sky."
"What kinds of compounds could indicate the presence of life on Wolf 1061 c?","Compounds like oxygen, methane, and carbon dioxide could indicate biological processes."
"How could gravitational interactions affect Wolf 1061 c?","Gravitational interactions with other planets in the system could influence Wolf 1061 c's orbit and stability."
"What advancements in spectroscopy could aid the study of Wolf 1061 c?","Advancements in high-resolution spectroscopy could enhance the detection of atmospheric components on Wolf 1061 c."
"What future missions could provide valuable data on Wolf 1061 c?","Missions like the James Webb Space Telescope could provide insights into Wolf 1061 c's atmosphere."
"What is the distance of Kapteyn b from Earth?","Kapteyn b is approximately 13.0 light-years away from Earth."
"What type of star is Kapteyn's Star?","Kapteyn's Star is a red dwarf star, classified as an M-type star."
"What is the mass of Kapteyn b compared to Earth?","Kapteyn b has an estimated mass of about 4.8 times that of Earth."
"Is Kapteyn b located in the habitable zone?","Yes, Kapteyn b is located within the habitable zone of its star."
"What is the orbital period of Kapteyn b?","The orbital period of Kapteyn b is approximately 48.6 days."
"What is the expected surface temperature of Kapteyn b?","The expected surface temperature of Kapteyn b could range between 0 and 30 degrees Celsius."
"How was Kapteyn b discovered?","Kapteyn b was discovered using the radial velocity method, which detects the gravitational pull of planets on their host star."
"Does Kapteyn b have any known moons?","As of now, there are no confirmed moons orbiting Kapteyn b."
"What are the primary scientific interests in Kapteyn b?","Primary interests include studying its potential habitability and atmospheric conditions."
"What is the distance of Kapteyn b from its host star?","Kapteyn b orbits at a distance of about 0.12 AU from Kapteyn's Star."
"Can Kapteyn b sustain liquid water?","If conditions are suitable, Kapteyn b may be capable of sustaining liquid water."
"What is known about the atmosphere of Kapteyn b?","The atmospheric conditions of Kapteyn b are largely unknown and require further study."
"What is the composition of Kapteyn b?","The exact composition of Kapteyn b is not well known, but it is likely rocky."
"What are some key features of Kapteyn b?","Key features include its size, proximity to Earth, and position within the habitable zone."
"What is the escape velocity of Kapteyn b?","The escape velocity of Kapteyn b is estimated to be around 26.5 km/s."
"What are the potential climatic conditions on Kapteyn b?","Potential climatic conditions could include a range of temperatures and varying weather patterns."
"Is Kapteyn b a tidally locked planet?","It is possible that Kapteyn b is tidally locked due to its close orbit to its star."
"What are the implications of finding Earth-like conditions on Kapteyn b?","Finding Earth-like conditions could provide insights into the prevalence of habitable worlds around red dwarfs."
"How does the radiation from Kapteyn's Star affect Kapteyn b?","Radiation from Kapteyn's Star may impact the atmosphere and surface conditions on Kapteyn b."
"What future missions could study Kapteyn b?","Future missions like the James Webb Space Telescope may provide insights into Kapteyn b's atmosphere."
"What challenges exist in studying Kapteyn b?","Challenges include its distance and the faintness of Kapteyn's Star, which complicates observations."
"What is the geological activity of Kapteyn b?","The geological activity of Kapteyn b is largely speculative and not well understood."
"What is the age of Kapteyn's Star?","Kapteyn's Star is estimated to be around 11 billion years old."
"Does Kapteyn b experience seasons?","If Kapteyn b has an axial tilt, it may experience seasonal variations, but this is speculative."
"What is the primary energy source for Kapteyn b?","The primary energy source for Kapteyn b is the radiation from its host star, Kapteyn's Star."
"What are the potential biosignatures to look for on Kapteyn b?","Potential biosignatures include gases like oxygen, methane, and other indicators of biological processes."
"What challenges do astronomers face in characterizing Kapteyn b?","Challenges include its distance, the faintness of Kapteyn's Star, and limited observational data."
"What types of exoplanets are similar to Kapteyn b?","Similar exoplanets include other super-Earths located in the habitable zones of red dwarf stars."
"How does the mass of Kapteyn b influence its potential habitability?","A larger mass may influence geological activity and the ability to retain an atmosphere."
"What are the potential impacts of stellar flares on Kapteyn b's atmosphere?","Stellar flares could strip away the atmosphere over time, affecting habitability."
"How might future missions study Kapteyn b?","Future missions could use transit photometry and direct imaging to gather data on Kapteyn b."
"What is the likelihood of finding water vapor on Kapteyn b?","If Kapteyn b has a suitable atmosphere, there is a chance of detecting water vapor."
"What are the potential tectonic activities on Kapteyn b?","The potential for tectonic activity on Kapteyn b is uncertain and would require more data."
"How does Kapteyn's Star's luminosity affect Kapteyn b?","The lower luminosity of Kapteyn's Star allows Kapteyn b to remain in the habitable zone at a closer distance."
"What is the significance of the Kapteyn system for astrobiology?","The Kapteyn system is significant for astrobiology due to its potential habitable planets."
"How might the atmosphere of Kapteyn b affect surface conditions?","The atmosphere of Kapteyn b could regulate temperatures and influence weather patterns."
"What is the best time to observe Kapteyn b from Earth?","The best time to observe Kapteyn b is when Kapteyn's Star is prominently visible in the night sky."
"What kinds of compounds could indicate the presence of life on Kapteyn b?","Compounds like oxygen, methane, and carbon dioxide could indicate biological processes."
"How could gravitational interactions affect Kapteyn b?","Gravitational interactions with other planets in the system could influence Kapteyn b's orbit and stability."
"What advancements in spectroscopy could aid the study of Kapteyn b?","Advancements in high-resolution spectroscopy could enhance the detection of atmospheric components on Kapteyn b."
"What future missions could provide valuable data on Kapteyn b?","Missions like the James Webb Space Telescope could provide insights into Kapteyn b's atmosphere."
"What is the composition of Kapteyn b's surface?","The exact composition of Kapteyn b's surface is not well known, but it is likely rocky."
"How might the rotation period of Kapteyn b affect its climate?","The rotation period could influence temperature distribution and weather patterns on Kapteyn b."
"What are the potential atmospheric conditions on Kapteyn b?","Potential atmospheric conditions may include a mix of gases similar to Earth's atmosphere."
"What is the significance of Kapteyn b's discovery?","The discovery of Kapteyn b contributes to the understanding of planetary systems around red dwarf stars."
"Is Kapteyn b part of a multi-planet system?","Yes, Kapteyn b is part of the Kapteyn system, which may contain other planets as well."
"How does the stellar activity of Kapteyn's Star impact Kapteyn b?","Stellar activity could affect the stability and composition of Kapteyn b's atmosphere."
"What is the escape velocity of Kapteyn b?","The escape velocity of Kapteyn b is estimated to be around 26.5 km/s."
"Does Kapteyn b have a magnetic field?","It is currently unknown if Kapteyn b has a magnetic field and how it might affect the planet."
"What are the possibilities for human exploration of Kapteyn b?","Human exploration of Kapteyn b is currently theoretical and would require advanced space travel technologies."
"What is the role of Kapteyn b in the search for extraterrestrial life?","Kapteyn b plays a role in the search for extraterrestrial life due to its location in the habitable zone."
"What is the primary challenge in studying Kapteyn b's atmosphere?","The primary challenge is obtaining sufficient data due to its distance and the faintness of its star."
"What are the potential surface features of Kapteyn b?","Potential surface features could include mountains, valleys, and bodies of water, but this is speculative."
"What is the history of research on Kapteyn b?","Research on Kapteyn b has evolved with advancements in detection methods for exoplanets."
"How does Kapteyn b compare to Earth in terms of size?","Kapteyn b is larger than Earth, with an estimated size about 1.5 times that of Earth."
"What are the potential weather patterns on Kapteyn b?","Potential weather patterns may vary widely, depending on its atmosphere and rotation."
"What kind of observations can confirm the existence of an atmosphere on Kapteyn b?","Observations of atmospheric composition and pressure can help confirm the existence of an atmosphere."
"How might future telescopes improve our understanding of Kapteyn b?","Future telescopes may provide higher-resolution images and spectra of Kapteyn b's atmosphere."
"What are the theoretical limits to life on Kapteyn b?","Theoretical limits to life could include temperature extremes, atmospheric pressure, and radiation levels."
"How does the environment of Kapteyn b compare to that of Mars?","Kapteyn b's environment is still largely unknown, but it may have more favorable conditions for life than Mars."
"What future studies could provide insights into the geology of Kapteyn b?","Future studies involving spectroscopic analysis could shed light on the geological composition of Kapteyn b."
"What is the distance of TRAPPIST-1 d from Earth?","TRAPPIST-1 d is approximately 40 light-years away from Earth."
"What type of star is TRAPPIST-1?","TRAPPIST-1 is an ultra-cool red dwarf star, classified as an M-type star."
"What is the mass of TRAPPIST-1 d compared to Earth?","TRAPPIST-1 d has an estimated mass of about 0.77 times that of Earth."
"Is TRAPPIST-1 d located in the habitable zone?","Yes, TRAPPIST-1 d is located within the habitable zone of its star."
"What is the orbital period of TRAPPIST-1 d?","The orbital period of TRAPPIST-1 d is approximately 13 days."
"What is the expected surface temperature of TRAPPIST-1 d?","The expected surface temperature of TRAPPIST-1 d could range between -20 and 10 degrees Celsius."
"How was TRAPPIST-1 d discovered?","TRAPPIST-1 d was discovered using the transit method, which detects the dimming of a star as a planet passes in front of it."
"Does TRAPPIST-1 d have any known moons?","As of now, there are no confirmed moons orbiting TRAPPIST-1 d."
"What are the primary scientific interests in TRAPPIST-1 d?","Primary interests include studying its potential for habitability and analyzing its atmosphere."
"What is the distance of TRAPPIST-1 d from its host star?","TRAPPIST-1 d orbits at a distance of about 0.22 AU from TRAPPIST-1."
"Can TRAPPIST-1 d sustain liquid water?","If conditions are suitable, TRAPPIST-1 d may be capable of sustaining liquid water."
"What is known about the atmosphere of TRAPPIST-1 d?","The atmospheric conditions of TRAPPIST-1 d are largely unknown and require further study."
"What is the composition of TRAPPIST-1 d?","The exact composition of TRAPPIST-1 d is not well known, but it is likely rocky."
"What are some key features of TRAPPIST-1 d?","Key features include its size, proximity to Earth, and position within the habitable zone."
"What is the escape velocity of TRAPPIST-1 d?","The escape velocity of TRAPPIST-1 d is estimated to be around 18.5 km/s."
"Does TRAPPIST-1 d have a magnetic field?","It is currently unknown if TRAPPIST-1 d has a magnetic field and how it might affect the planet."
"What are the possibilities for human exploration of TRAPPIST-1 d?","Human exploration of TRAPPIST-1 d is currently theoretical and would require advanced space travel technologies."
"What is the role of TRAPPIST-1 d in the search for extraterrestrial life?","TRAPPIST-1 d plays a role in the search for extraterrestrial life due to its location in the habitable zone."
"How does the radiation from TRAPPIST-1 affect TRAPPIST-1 d?","Radiation from TRAPPIST-1 could impact the atmosphere and surface conditions on TRAPPIST-1 d."
"What future missions could study TRAPPIST-1 d?","Future missions like the James Webb Space Telescope may provide insights into TRAPPIST-1 d's atmosphere."
"What is the geological activity of TRAPPIST-1 d?","The geological activity of TRAPPIST-1 d is largely speculative and not well understood."
"What is the age of TRAPPIST-1?","TRAPPIST-1 is estimated to be around 5-7 billion years old."
"Does TRAPPIST-1 d experience seasons?","If TRAPPIST-1 d has an axial tilt, it may experience seasonal variations, but this is speculative."
"What is the primary energy source for TRAPPIST-1 d?","The primary energy source for TRAPPIST-1 d is the radiation from its host star, TRAPPIST-1."
"What are the potential biosignatures to look for on TRAPPIST-1 d?","Potential biosignatures include gases like oxygen, methane, and other indicators of biological processes."
"What challenges do astronomers face in characterizing TRAPPIST-1 d?","Challenges include its distance, the faintness of TRAPPIST-1, and limited observational data."
"What types of exoplanets are similar to TRAPPIST-1 d?","Similar exoplanets include other rocky planets located in the habitable zones of M-type stars."
"How does the mass of TRAPPIST-1 d influence its potential habitability?","A smaller mass may influence geological activity and the ability to retain an atmosphere."
"What are the potential climatic conditions on TRAPPIST-1 d?","Potential climatic conditions could include a range of temperatures and varying weather patterns."
"Is TRAPPIST-1 d a tidally locked planet?","It is likely that TRAPPIST-1 d is tidally locked due to its close orbit to its star."
"What are the implications of finding Earth-like conditions on TRAPPIST-1 d?","Finding Earth-like conditions could provide insights into the prevalence of habitable worlds around red dwarfs."
"How might future missions study TRAPPIST-1 d?","Future missions could use transit photometry and direct imaging to gather data on TRAPPIST-1 d."
"What is the escape velocity of TRAPPIST-1 d?","The escape velocity of TRAPPIST-1 d is estimated to be around 18.5 km/s."
"What are the potential tectonic activities on TRAPPIST-1 d?","The potential for tectonic activity on TRAPPIST-1 d is uncertain and would require more data."
"What is the best time to observe TRAPPIST-1 d from Earth?","The best time to observe TRAPPIST-1 d is when TRAPPIST-1 is prominently visible in the night sky."
"What kinds of compounds could indicate the presence of life on TRAPPIST-1 d?","Compounds like oxygen, methane, and carbon dioxide could indicate biological processes."
"What are the theoretical limits to life on TRAPPIST-1 d?","Theoretical limits to life could include temperature extremes, atmospheric pressure, and radiation levels."
"What future studies could provide insights into the geology of TRAPPIST-1 d?","Future studies involving spectroscopic analysis could shed light on the geological composition of TRAPPIST-1 d."
"How does the environment of TRAPPIST-1 d compare to that of Earth?","TRAPPIST-1 d is expected to have conditions that could be similar to those on Earth."
"What are the potential weather patterns on TRAPPIST-1 d?","Potential weather patterns may vary widely, depending on its atmosphere and rotation."
"What advancements in spectroscopy could aid the study of TRAPPIST-1 d?","Advancements in high-resolution spectroscopy could enhance the detection of atmospheric components on TRAPPIST-1 d."
"What is the surface pressure on TRAPPIST-1 d?","The surface pressure on TRAPPIST-1 d is not well known but could be similar to Earth's if it has a dense atmosphere."
"How might the geology of TRAPPIST-1 d differ from Earth?","The geology of TRAPPIST-1 d could differ significantly due to its different formation conditions and proximity to its star."
"What is the expected albedo of TRAPPIST-1 d?","The expected albedo of TRAPPIST-1 d is not well studied, but it could vary based on surface composition."
"What types of clouds might exist on TRAPPIST-1 d?","If TRAPPIST-1 d has an atmosphere, it could potentially host water vapor clouds or other types of clouds."
"What role does tidal heating play on TRAPPIST-1 d?","Tidal heating could influence geological activity if TRAPPIST-1 d is tidally locked and experiences gravitational forces."
"Could TRAPPIST-1 d support life as we know it?","If conditions are suitable, TRAPPIST-1 d could potentially support life similar to that on Earth."
"What tools can scientists use to study TRAPPIST-1 d's atmosphere?","Scientists can use telescopes equipped with spectrometers to analyze the atmosphere of TRAPPIST-1 d."
"What is the importance of the TRAPPIST-1 system for astrobiology?","The TRAPPIST-1 system is important for astrobiology due to the presence of multiple Earth-sized planets in the habitable zone."
"What are the potential impacts of stellar flares from TRAPPIST-1 on TRAPPIST-1 d?","Stellar flares could strip away the atmosphere and affect habitability on TRAPPIST-1 d."
"How might researchers detect water on TRAPPIST-1 d?","Researchers could detect water by analyzing the spectrum of light filtering through its atmosphere."
"What are the potential surface conditions on TRAPPIST-1 d?","Potential surface conditions may include rocky terrain, possible bodies of water, and varying temperatures."
"What is the significance of studying TRAPPIST-1 d for understanding planetary formation?","Studying TRAPPIST-1 d can provide insights into the formation and evolution of rocky planets around red dwarf stars."
"How does the gravity of TRAPPIST-1 d compare to that of Earth?","The gravity of TRAPPIST-1 d is likely lower than that of Earth due to its smaller mass."
"How often does TRAPPIST-1 d transit its star?","TRAPPIST-1 d completes a full orbit around its star in approximately 13 Earth days."
"What are the theoretical atmospheric compositions for TRAPPIST-1 d?","Theoretical atmospheric compositions could include nitrogen, carbon dioxide, and possibly water vapor."
"Is there any evidence of past volcanic activity on TRAPPIST-1 d?","As of now, there is no direct evidence of past volcanic activity on TRAPPIST-1 d."
"What advancements in observational techniques could enhance our study of TRAPPIST-1 d?","Advancements in adaptive optics and space-based telescopes could significantly improve observations of TRAPPIST-1 d."
"What is the significance of finding diverse planetary systems like TRAPPIST-1?","Finding diverse planetary systems helps scientists understand the variety of planetary formations and potential for habitability."
"What is the expected longevity of TRAPPIST-1 d's atmosphere?","The longevity of TRAPPIST-1 d's atmosphere depends on factors like stellar radiation and geological activity."
"What are the challenges of communicating findings about TRAPPIST-1 d to the public?","Challenges include conveying complex scientific concepts in an understandable way and addressing misconceptions."

