Question,Answer
"What is the name of the exoplanet closest to Earth?","The closest exoplanet to Earth is Proxima Centauri b."
"Which galaxy is Proxima Centauri b located in?","Proxima Centauri b is located in the Milky Way galaxy."
"What star does Proxima Centauri b orbit?","Proxima Centauri b orbits the star Proxima Centauri."
"Is Proxima Centauri b considered a habitable planet?","Proxima Centauri b is potentially habitable, but its habitability has not yet been confirmed."
"How far is Proxima Centauri b from Earth?","Proxima Centauri b is 4.24 light-years away from Earth."
"What is known about the atmosphere of Proxima Centauri b?","The atmospheric conditions of Proxima Centauri b are uncertain. It may have a thin atmosphere, but this has not been confirmed."
"Can Proxima Centauri b support life?","It is not yet known if Proxima Centauri b can support life. While it is in the habitable zone, more research is needed to determine its potential for life."
"How does Proxima Centauri b compare to Earth?","Proxima Centauri b is similar in size to Earth and is located in the habitable zone of its star, but its atmospheric and surface conditions are still unknown."
"What is the name of the exoplanet that orbits Barnard's Star?","The exoplanet that orbits Barnard's Star is called Barnard's Star b."
"Which galaxy is Barnard's Star b located in?","Barnard's Star b is located in the Milky Way galaxy."
"Is Barnard's Star b considered a habitable planet?","Barnard's Star b is not considered habitable due to its extremely cold temperature."
"How far is Barnard's Star b from Earth?","Barnard's Star b is 5.96 light-years away from Earth."
"What is known about the atmosphere of Barnard's Star b?","The atmosphere of Barnard's Star b is unknown, but it is likely cold and inhospitable."
"Can Barnard's Star b support life?","Barnard's Star b is unlikely to support life due to its extreme cold and distance from its star."
"How does Barnard's Star b compare to Earth?","Barnard's Star b is much colder than Earth and is located farther from its star, making it less likely to be habitable."
"What is the name of the exoplanet that orbits Ross 128?","The exoplanet that orbits Ross 128 is called Ross 128 b."
"Which galaxy is Ross 128 b located in?","Ross 128 b is located in the Milky Way galaxy."
"Is Ross 128 b considered a habitable planet?","Ross 128 b is potentially habitable, but further studies are needed to confirm its habitability."
"How far is Ross 128 b from Earth?","Ross 128 b is 11.03 light-years away from Earth."
"What is known about the atmosphere of Ross 128 b?","The atmosphere of Ross 128 b is not yet known, but it could be temperate due to its location in the habitable zone."
"Can Ross 128 b support life?","Ross 128 b may be able to support life, but its atmospheric and surface conditions are still under investigation."
"How does Ross 128 b compare to Earth?","Ross 128 b is Earth-like in size and may have temperate conditions, but its habitability is still uncertain."
"What is the name of the exoplanet that orbits Luyten's Star?","The exoplanet that orbits Luyten's Star is called Luyten b."
"Which galaxy is Luyten b located in?","Luyten b is located in the Milky Way galaxy."
"Is Luyten b considered a habitable planet?","Luyten b is considered potentially habitable, as it lies in the habitable zone of its star."
"How far is Luyten b from Earth?","Luyten b is 12.2 light-years away from Earth."
"What is known about the atmosphere of Luyten b?","The atmosphere of Luyten b is unknown, but its position in the habitable zone suggests it may have suitable conditions."
"Can Luyten b support life?","Luyten b could potentially support life, but more data on its atmospheric and surface conditions is needed."
"How does Luyten b compare to Earth?","Luyten b is similar in size to Earth and is located in its star's habitable zone, making it a candidate for potential habitability."
"What is the name of the exoplanet that orbits Teegarden's Star?","The exoplanet that orbits Teegarden's Star is called Teegarden b."
"Which galaxy is Teegarden b located in?","Teegarden b is located in the Milky Way galaxy."
"Is Teegarden b considered a habitable planet?","Teegarden b is considered potentially habitable due to its location in the habitable zone of its star."
"How far is Teegarden b from Earth?","Teegarden b is 12.5 light-years away from Earth."
"What is known about the atmosphere of Teegarden b?","The atmosphere of Teegarden b is currently unknown, though it may have temperate conditions."
"Can Teegarden b support life?","Teegarden b could potentially support life, but more data is needed to confirm its atmospheric and surface conditions."
"How does Teegarden b compare to Earth?","Teegarden b is Earth-like in size and located in the habitable zone, making it a possible candidate for habitability."
"What is the name of the exoplanet that orbits Gliese 1061?","The exoplanet that orbits Gliese 1061 is called Gliese 1061 d."
"Which galaxy is Gliese 1061 d located in?","Gliese 1061 d is located in the Milky Way galaxy."
"Is Gliese 1061 d considered a habitable planet?","Gliese 1061 d is potentially habitable, but its habitability has not been confirmed."
"How far is Gliese 1061 d from Earth?","Gliese 1061 d is 12.0 light-years away from Earth."
"What is known about the atmosphere of Gliese 1061 d?","The atmosphere of Gliese 1061 d is unknown, but it is in the habitable zone, making it a candidate for further study."
"Can Gliese 1061 d support life?","Gliese 1061 d might support life, but further investigation is required to determine its conditions."
"How does Gliese 1061 d compare to Earth?","Gliese 1061 d is located in its star's habitable zone, similar to Earth, but more research is needed to assess its conditions."
"What is the name of the exoplanet that orbits YZ Ceti?","The exoplanet that orbits YZ Ceti is called YZ Ceti d."
"Which galaxy is YZ Ceti d located in?","YZ Ceti d is located in the Milky Way galaxy."
"Is YZ Ceti d considered a habitable planet?","YZ Ceti d is not considered habitable due to extreme radiation levels."
"How far is YZ Ceti d from Earth?","YZ Ceti d is 12.1 light-years away from Earth."
"What is known about the atmosphere of YZ Ceti d?","The atmosphere of YZ Ceti d is unknown, but the high radiation levels suggest it's inhospitable."
"Can YZ Ceti d support life?","YZ Ceti d is unlikely to support life due to the extreme radiation it receives from its star."
"How does YZ Ceti d compare to Earth?","YZ Ceti d is much less hospitable than Earth, as it is subjected to extreme radiation and unlikely to support life."
"What is the name of the exoplanet that orbits Wolf 1061?","The exoplanet that orbits Wolf 1061 is called Wolf 1061 c."
"Which galaxy is Wolf 1061 c located in?","Wolf 1061 c is located in the Milky Way galaxy."
"Is Wolf 1061 c considered a habitable planet?","Wolf 1061 c is not considered habitable, as it is likely too hot to support life."
"How far is Wolf 1061 c from Earth?","Wolf 1061 c is 13.8 light-years away from Earth."
"What is known about the atmosphere of Wolf 1061 c?","The atmosphere of Wolf 1061 c is not well understood, but it is likely inhospitable due to high temperatures."
"Can Wolf 1061 c support life?","Wolf 1061 c is unlikely to support life because it is expected to be too hot and have extreme conditions."
"How does Wolf 1061 c compare to Earth?","Wolf 1061 c is hotter than Earth and is not situated in the habitable zone, making it less likely to support life."
"What is the name of the exoplanet that orbits Kapteyn's Star?","The exoplanet that orbits Kapteyn's Star is called Kapteyn b."
"Which galaxy is Kapteyn b located in?","Kapteyn b is located in the Milky Way galaxy."
"Is Kapteyn b considered a habitable planet?","Kapteyn b is considered potentially habitable, but its habitability is not yet confirmed."
"How far is Kapteyn b from Earth?","Kapteyn b is 12.8 light-years away from Earth."
"What is known about the atmosphere of Kapteyn b?","The atmospheric conditions of Kapteyn b are unknown, but it is in the habitable zone of its star."
"Can Kapteyn b support life?","Kapteyn b may be able to support life, but more research is needed to understand its conditions."
"How does Kapteyn b compare to Earth?","Kapteyn b is similar in size to Earth and is in the habitable zone, suggesting it could have conditions suitable for life."
"What is the name of the exoplanet that orbits Gliese 581?","The exoplanet that orbits Gliese 581 is called Gliese 581 d."
"Which galaxy is Gliese 581 d located in?","Gliese 581 d is located in the Milky Way galaxy."
"Is Gliese 581 d considered a habitable planet?","Gliese 581 d is considered potentially habitable, but its actual conditions remain uncertain."
"How far is Gliese 581 d from Earth?","Gliese 581 d is 20.3 light-years away from Earth."
"What is known about the atmosphere of Gliese 581 d?","The atmosphere of Gliese 581 d is unknown, but it may have a thick atmosphere capable of supporting liquid water."
"Can Gliese 581 d support life?","Gliese 581 d has the potential to support life, but further studies are needed to determine its habitability."
"How does Gliese 581 d compare to Earth?","Gliese 581 d is larger than Earth and lies in the habitable zone, which makes it an interesting target for further exploration."
"What is the name of the exoplanet closest to Earth?","The closest exoplanet to Earth is Proxima Centauri b."
"Which galaxy is Proxima Centauri b located in?","Proxima Centauri b is located in the Milky Way galaxy."
"What star does Proxima Centauri b orbit?","Proxima Centauri b orbits the star Proxima Centauri."
"Is Proxima Centauri b considered a habitable planet?","Proxima Centauri b is potentially habitable, but its habitability has not yet been confirmed."
"How far is Proxima Centauri b from Earth?","Proxima Centauri b is 4.24 light-years away from Earth."
"What is known about the atmosphere of Proxima Centauri b?","The atmospheric conditions of Proxima Centauri b are uncertain. It may have a thin atmosphere, but this has not been confirmed."
"What is the mass of Proxima Centauri b compared to Earth?","Proxima Centauri b has a mass approximately 1.17 times that of Earth."
"How long is a year on Proxima Centauri b?","A year on Proxima Centauri b is about 11.2 Earth days long."
"What type of planet is Proxima Centauri b?","Proxima Centauri b is classified as a terrestrial planet."
"What is the surface temperature of Proxima Centauri b?","The surface temperature of Proxima Centauri b is not precisely known, but estimates suggest it could be between -40 to 60 degrees Celsius."
"Does Proxima Centauri b have any moons?","As of now, no moons have been confirmed orbiting Proxima Centauri b."
"What is the composition of Proxima Centauri b's atmosphere?","The composition of Proxima Centauri b's atmosphere remains unknown due to limited data."
"How was Proxima Centauri b discovered?","Proxima Centauri b was discovered using the radial velocity method by observing the wobble of its host star, Proxima Centauri."
"What is the age of Proxima Centauri b's host star?","Proxima Centauri is estimated to be about 4.85 billion years old."
"What is the distance of Proxima Centauri b from its host star?","Proxima Centauri b orbits at a distance of about 0.0485 AU from Proxima Centauri."
"Can Proxima Centauri b be seen with the naked eye?","No, Proxima Centauri b cannot be seen with the naked eye; it is too faint."
"What is the significance of Proxima Centauri b in the search for extraterrestrial life?","Proxima Centauri b is significant because it lies within the habitable zone of its star, making it a candidate for potential life."
"What is the orbital period of Proxima Centauri b?","The orbital period of Proxima Centauri b is approximately 11.2 days."
"What is the rotational period of Proxima Centauri b?","The rotational period of Proxima Centauri b is not well known, but it may be tidally locked to its star."
"How does Proxima Centauri b compare to Venus?","Proxima Centauri b is more Earth-like than Venus in terms of potential habitability, though much about its conditions remains unknown."
"What instruments were used to detect Proxima Centauri b?","Proxima Centauri b was detected using the HARPS spectrograph and other telescopes focused on radial velocity measurements."
"Is there any direct imaging of Proxima Centauri b?","No, there is currently no direct imaging of Proxima Centauri b; observations are based on indirect data."
"What challenges exist in studying Proxima Centauri b?","Challenges include its distance from Earth and the faintness of its host star, making detailed observations difficult."
"What missions are planned to study Proxima Centauri b?","Future missions like the James Webb Space Telescope may provide insights into Proxima Centauri b's atmosphere."
"What is the albedo of Proxima Centauri b?","The albedo of Proxima Centauri b is not well established, as there is limited observational data."
"What is the potential for water on Proxima Centauri b?","There is potential for liquid water on Proxima Centauri b, but further studies are needed to confirm its presence."
"What is the diameter of Proxima Centauri b compared to Earth?","Proxima Centauri b has a diameter about 1.3 times that of Earth."
"What is the gravitational pull on Proxima Centauri b?","The gravitational pull on Proxima Centauri b is estimated to be about 1.1 times that of Earth's."
"What is the temperature range expected on Proxima Centauri b?","The temperature range on Proxima Centauri b is expected to vary significantly, potentially from -40 to 60 degrees Celsius."
"Does Proxima Centauri b experience seasons?","It is unclear if Proxima Centauri b experiences seasons, as it may be tidally locked to its star."
"What is the likelihood of finding life on Proxima Centauri b?","While Proxima Centauri b is in the habitable zone, the likelihood of finding life depends on its atmosphere and environmental conditions."
"What are the key features of Proxima Centauri b?","Key features include its Earth-like size, location in the habitable zone, and proximity to Earth."
"How does the radiation from Proxima Centauri affect Proxima Centauri b?","Proxima Centauri emits stellar flares, which may impact the atmospheric conditions of Proxima Centauri b."
"Is Proxima Centauri b a rocky or gas giant?","Proxima Centauri b is considered a rocky planet."
"What role does Proxima Centauri b play in exoplanet research?","Proxima Centauri b is a crucial target in the search for potentially habitable exoplanets."
"How can we study the atmosphere of Proxima Centauri b?","The atmosphere can be studied through spectroscopy during transits, but direct observations are currently limited."
"What is the historical significance of Proxima Centauri b's discovery?","The discovery of Proxima Centauri b marked a significant milestone in the search for habitable exoplanets."
"How does Proxima Centauri b's orbit compare to Earth's?","Proxima Centauri b has a much shorter orbital period compared to Earth's 365 days."
"Are there any planned missions specifically targeting Proxima Centauri b?","Yes, missions like the Breakthrough Starshot initiative aim to explore the Alpha Centauri system, including Proxima Centauri b."
"What potential challenges do spacecraft face when traveling to Proxima Centauri b?","Challenges include the vast distance of 4.24 light-years and the need for advanced propulsion technologies."
"What effect does Proxima Centauri b's proximity to its star have on its climate?","Proxima Centauri b's close proximity may result in extreme temperature variations and atmospheric conditions."
"What are some theories about the potential for life on Proxima Centauri b?","Theories suggest that if liquid water exists, life could develop, but radiation levels may be a significant obstacle."
"What is the primary method for discovering exoplanets like Proxima Centauri b?","The radial velocity method is commonly used to detect exoplanets by measuring the star's wobble."
"How does Proxima Centauri b's distance from Earth compare to other known exoplanets?","Proxima Centauri b is the closest known exoplanet to Earth."
"What are the future implications of studying Proxima Centauri b?","Studying Proxima Centauri b could enhance our understanding of planet formation and habitability in other star systems."
"How does Proxima Centauri b's star differ from the Sun?","Proxima Centauri is a red dwarf star, which is smaller and cooler than the Sun."
"What is the escape velocity of Proxima Centauri b?","The escape velocity of Proxima Centauri b is estimated to be about 5.2 km/s."
"How long would it take to travel to Proxima Centauri b with current technology?","With current technology, it would take over 6,700 years to reach Proxima Centauri b."
"What is the orbital inclination of Proxima Centauri b?","The orbital inclination of Proxima Centauri b is not well determined due to its distance."
"Does Proxima Centauri b have a magnetic field?","It is uncertain if Proxima Centauri b has a significant magnetic field, which would protect its atmosphere."
"What are the atmospheric conditions on Proxima Centauri b?","The atmospheric conditions on Proxima Centauri b are unknown and subject to ongoing research."
"What other planets orbit Proxima Centauri?","Proxima Centauri has at least one other known planet, Proxima Centauri c, which is a super-Earth."
"What is the potential for finding water on Proxima Centauri b?","The potential for finding liquid water exists if conditions allow for a stable atmosphere."
"What is the geological activity of Proxima Centauri b?","The geological activity of Proxima Centauri b is currently unknown, as no direct observations have been made."
"Are there any significant landmarks on Proxima Centauri b?","As of now, no significant landmarks on Proxima Centauri b have been identified due to limited data."
"What role does Proxima Centauri b play in the study of planetary systems?","Proxima Centauri b serves as a model for understanding the formation and evolution of terrestrial planets."
"What is the expected surface pressure on Proxima Centauri b?","The expected surface pressure on Proxima Centauri b is uncertain and requires further investigation."
"Can Proxima Centauri b support life as we know it?","Proxima Centauri b may support life, but the exact conditions are still speculative."
"What is the significance of Proxima Centauri b's habitable zone?","Proxima Centauri b's location in the habitable zone makes it a key target in the search for extraterrestrial life."
"What are the effects of stellar flares on Proxima Centauri b?","Stellar flares could strip away the atmosphere of Proxima Centauri b, affecting its habitability."
"What is the potential for colonization of Proxima Centauri b?","Colonization of Proxima Centauri b would face numerous challenges, including radiation exposure and distance from Earth."
"What is the current understanding of Proxima Centauri b's climate?","The climate of Proxima Centauri b is largely unknown, but it may have a range of conditions depending on atmospheric composition."
"How do scientists measure the size of Proxima Centauri b?","Scientists measure the size of Proxima Centauri b using transit observations and radial velocity data."
"What is the history of observations related to Proxima Centauri b?","Proxima Centauri b has been observed since its discovery in 2016, leading to ongoing research."
"What is the potential for communication with a hypothetical civilization on Proxima Centauri b?","Communication would be challenging due to the vast distance and time delays involved."
"What impact could Proxima Centauri b have on our understanding of life beyond Earth?","Studying Proxima Centauri b may provide insights into the conditions necessary for life on other planets."
"What is the name of the exoplanet orbiting Barnard's Star?","The exoplanet orbiting Barnard's Star is called Barnard's Star b."
"How far is Barnard's Star b from Earth?","Barnard's Star b is approximately 6 light-years away from Earth."
"What type of planet is Barnard's Star b?","Barnard's Star b is classified as a super-Earth."
"What is the mass of Barnard's Star b compared to Earth?","Barnard's Star b has a mass estimated to be about 3.2 times that of Earth."
"Is Barnard's Star b located in the habitable zone?","Barnard's Star b is located just outside the habitable zone of its star."
"What is the surface temperature of Barnard's Star b?","The surface temperature of Barnard's Star b is estimated to be around -170 degrees Celsius."
"What is the orbital period of Barnard's Star b?","The orbital period of Barnard's Star b is about 233 days."
"Does Barnard's Star b have any moons?","As of now, no moons have been confirmed orbiting Barnard's Star b."
"What is the significance of Barnard's Star b in exoplanet research?","Barnard's Star b is significant due to its proximity and potential habitability."
"How was Barnard's Star b discovered?","Barnard's Star b was discovered using the radial velocity method, observing the star's wobble."
"What challenges exist in studying Barnard's Star b?","Challenges include its distance from Earth and the faintness of Barnard's Star."
"What is the composition of Barnard's Star b?","The exact composition of Barnard's Star b is not well known, but it is likely rocky."
"What is the age of Barnard's Star?","Barnard's Star is estimated to be around 10 billion years old."
"How does Barnard's Star b compare to Proxima Centauri b?","Barnard's Star b is more massive than Proxima Centauri b and is located farther from its star."
"What is the potential for water on Barnard's Star b?","The potential for liquid water exists, but the extreme cold may limit its presence."
"Can Barnard's Star b support life as we know it?","It is uncertain if Barnard's Star b can support life due to its cold temperatures."
"What is the distance of Barnard's Star b from its host star?","Barnard's Star b orbits at a distance of about 0.4 AU from Barnard's Star."
"What instruments were used to detect Barnard's Star b?","Barnard's Star b was detected using the HARPS spectrograph and other radial velocity measurements."
"How does Barnard's Star's luminosity affect Barnard's Star b?","Barnard's Star is a dim red dwarf, leading to colder conditions on Barnard's Star b."
"What is the expected atmospheric pressure on Barnard's Star b?","The atmospheric pressure on Barnard's Star b is uncertain and requires further study."
"What future missions could study Barnard's Star b?","Future missions like the James Webb Space Telescope may provide insights into Barnard's Star b's atmosphere."
"What is the escape velocity of Barnard's Star b?","The escape velocity of Barnard's Star b is estimated to be around 5.5 km/s."
"What is the orbital inclination of Barnard's Star b?","The orbital inclination of Barnard's Star b is not well known due to limited data."
"Is Barnard's Star b a tidally locked planet?","It is unclear if Barnard's Star b is tidally locked, but it may be due to its close orbit."
"What is the main atmospheric component expected on Barnard's Star b?","The main atmospheric component is unknown, but it may contain gases similar to Earth."
"What are the key features of Barnard's Star b?","Key features include its size, potential for an atmosphere, and its proximity to Earth."
"Does Barnard's Star b have a magnetic field?","It is currently unknown whether Barnard's Star b has a significant magnetic field."
"What is the geological activity of Barnard's Star b?","The geological activity of Barnard's Star b is largely speculative and not well understood."
"What is the significance of Barnard's Star b's discovery?","Barnard's Star b's discovery provides insights into the diversity of exoplanets."
"How does the radiation from Barnard's Star affect Barnard's Star b?","Barnard's Star emits less radiation than the Sun, potentially allowing for a more stable atmosphere."
"What is the expected surface pressure on Barnard's Star b?","The expected surface pressure on Barnard's Star b is not well established due to limited data."
"Can Barnard's Star b sustain liquid water?","Liquid water could theoretically exist if conditions are right, but temperatures are very low."
"What is the primary method for studying Barnard's Star b?","The primary method is radial velocity measurements to detect wobbles in Barnard's Star."
"How does the atmosphere of Barnard's Star b compare to Earth's?","The atmosphere of Barnard's Star b is uncertain and may differ significantly from Earth's."
"What are some potential future studies of Barnard's Star b?","Future studies may focus on its atmospheric composition and potential habitability."
"Is Barnard's Star b part of a multi-planet system?","As of now, Barnard's Star b is the only confirmed planet in the Barnard's Star system."
"What role does Barnard's Star b play in understanding super-Earths?","Barnard's Star b helps scientists learn more about the characteristics and formation of super-Earths."
"What are the long-term implications of studying Barnard's Star b?","Studying Barnard's Star b could inform our understanding of planetary systems and their potential for life."
"What are the distances of Barnard's Star b compared to other known exoplanets?","Barnard's Star b is one of the closest known exoplanets to Earth, at approximately 6 light-years away."
"What is the historical context of Barnard's Star?","Barnard's Star has been studied for over a century and was first cataloged by Edward Emerson Barnard."
"What future telescopes could observe Barnard's Star b?","Next-generation telescopes like the Extremely Large Telescope may provide valuable data on Barnard's Star b."
"What is the radius of Barnard's Star b compared to Earth?","Barnard's Star b is estimated to have a radius about 1.2 times that of Earth."
