Question,Answer
"What is the primary research focus regarding Barnard's Star b?","The primary research focus is on its potential habitability and atmospheric conditions."
"Does Barnard's Star b have seasonal variations?","It is unclear if Barnard's Star b experiences seasonal variations due to its distance from its star."
"What is the effect of stellar winds from Barnard's Star on Barnard's Star b?","Stellar winds may impact the atmosphere of Barnard's Star b, but more research is needed."
"How might Barnard's Star b affect our understanding of planet formation?","Barnard's Star b may provide insights into the formation and evolution of super-Earths."
"What type of star is Barnard's Star?","Barnard's Star is a red dwarf star, specifically a type M5.5."
"What is the light curve of Barnard's Star b?","The light curve of Barnard's Star b is not well characterized, requiring further observational data."
"What role do gravitational interactions play in Barnard's Star b's orbit?","Gravitational interactions with Barnard's Star influence the orbital dynamics of Barnard's Star b."
"What tools are used to simulate the climate of Barnard's Star b?","Climate models and simulations are used to predict the atmospheric conditions on Barnard's Star b."
"What is the potential for discovering additional planets around Barnard's Star?","There is potential for discovering more planets, as further observations may reveal additional companions."
"How do scientists assess the habitability of Barnard's Star b?","Scientists assess habitability by studying potential surface conditions and atmospheric composition."
"What is the history of exoplanet discoveries around red dwarf stars?","Many exoplanets, including Barnard's Star b, have been discovered around red dwarf stars due to their abundance."
"What is the potential for future human exploration of Barnard's Star b?","Future human exploration is currently theoretical due to technological and logistical challenges."
"What are the expected weather patterns on Barnard's Star b?","Expected weather patterns are uncertain, but extreme cold is likely due to its distance from the star."
"How does the low luminosity of Barnard's Star affect Barnard's Star b?","The low luminosity results in colder temperatures on Barnard's Star b compared to Earth."
"What challenges do scientists face in characterizing Barnard's Star b's atmosphere?","Challenges include the planet's distance and the faintness of its host star, which complicates observations."
"Is Barnard's Star b's orbit circular or elliptical?","The orbit of Barnard's Star b is considered to be nearly circular."
"What is the significance of Barnard's Star b's cold temperatures?","The cold temperatures influence its potential for sustaining liquid water and life."
"What impact could Barnard's Star b have on future astronomical research?","Barnard's Star b may lead to new discoveries regarding exoplanet atmospheres and habitability."
"What technological advancements are needed to study Barnard's Star b further?","Advancements in spectroscopy and imaging techniques are necessary for detailed studies of Barnard's Star b."
"What is the name of the exoplanet orbiting Ross 128?","The exoplanet orbiting Ross 128 is called Ross 128 b."
"How far is Ross 128 b from Earth?","Ross 128 b is approximately 11 light-years away from Earth."
"What type of planet is Ross 128 b?","Ross 128 b is classified as a super-Earth."
"What is the mass of Ross 128 b compared to Earth?","Ross 128 b has a mass estimated to be about 1.4 times that of Earth."
"Is Ross 128 b located in the habitable zone?","Ross 128 b is located within the habitable zone of its star."
"What is the surface temperature of Ross 128 b?","The surface temperature of Ross 128 b is estimated to be around -60 degrees Celsius."
"What is the orbital period of Ross 128 b?","The orbital period of Ross 128 b is about 9.9 days."
"Does Ross 128 b have any known moons?","As of now, no moons have been confirmed orbiting Ross 128 b."
"What is the significance of Ross 128 b in exoplanet research?","Ross 128 b is significant due to its proximity and potential for habitability."
"How was Ross 128 b discovered?","Ross 128 b was discovered using the radial velocity method, observing the star's wobble."
"What challenges exist in studying Ross 128 b?","Challenges include its distance from Earth and the faintness of Ross 128."
"What is the composition of Ross 128 b?","The exact composition of Ross 128 b is not well known, but it is likely rocky."
"What is the age of Ross 128?","Ross 128 is estimated to be around 5 billion years old."
"How does Ross 128 b compare to Proxima Centauri b?","Ross 128 b is larger and is located at a greater distance from its star than Proxima Centauri b."
"What is the potential for water on Ross 128 b?","The potential for liquid water exists if conditions allow for a stable atmosphere."
"Can Ross 128 b support life as we know it?","It is uncertain if Ross 128 b can support life, but it is a candidate for further research."
"What is the distance of Ross 128 b from its host star?","Ross 128 b orbits at a distance of about 0.04 AU from Ross 128."
"What instruments were used to detect Ross 128 b?","Ross 128 b was detected using the HARPS spectrograph and other radial velocity measurements."
"How does the luminosity of Ross 128 affect Ross 128 b?","The low luminosity of Ross 128 allows for conditions that could support liquid water on Ross 128 b."
"What is the expected atmospheric pressure on Ross 128 b?","The expected atmospheric pressure on Ross 128 b is not well established and requires further study."
"What future missions could study Ross 128 b?","Future missions like the James Webb Space Telescope may provide insights into Ross 128 b's atmosphere."
"What is the escape velocity of Ross 128 b?","The escape velocity of Ross 128 b is estimated to be around 5.0 km/s."
"What is the orbital inclination of Ross 128 b?","The orbital inclination of Ross 128 b is not well known due to limited data."
"Is Ross 128 b a tidally locked planet?","It is unclear if Ross 128 b is tidally locked, but it may be due to its close orbit."
"What is the main atmospheric component expected on Ross 128 b?","The main atmospheric component is unknown, but it may contain gases similar to Earth."
"What are the key features of Ross 128 b?","Key features include its size, proximity to Earth, and potential habitability."
"Does Ross 128 b have a magnetic field?","It is currently unknown whether Ross 128 b has a significant magnetic field."
"What is the geological activity of Ross 128 b?","The geological activity of Ross 128 b is largely speculative and not well understood."
"What is the significance of Ross 128 b's discovery?","Ross 128 b's discovery provides insights into the diversity of exoplanets and their potential for life."
"How does the radiation from Ross 128 affect Ross 128 b?","Ross 128 emits less radiation than the Sun, which may allow for a more stable atmosphere on Ross 128 b."
"What is the expected surface pressure on Ross 128 b?","The expected surface pressure on Ross 128 b is uncertain and requires further study."
"Can Ross 128 b sustain liquid water?","Liquid water could theoretically exist if conditions are suitable, but more data is needed."
"What is the primary method for studying Ross 128 b?","The primary method is radial velocity measurements to detect the wobble of Ross 128."
"How does the atmosphere of Ross 128 b compare to Earth's?","The atmosphere of Ross 128 b is uncertain and may differ significantly from Earth's due to its unique conditions."
"What are some potential future studies of Ross 128 b?","Future studies may focus on its atmospheric composition and habitability prospects."
"Is Ross 128 b part of a multi-planet system?","As of now, Ross 128 b is the only confirmed planet in the Ross 128 system."
"What role does Ross 128 b play in understanding super-Earths?","Ross 128 b helps scientists learn more about the characteristics and potential habitability of super-Earths."
"What are the distances of Ross 128 b compared to other known exoplanets?","Ross 128 b is one of the closest known exoplanets to Earth, at approximately 11 light-years away."
"What is the historical context of Ross 128?","Ross 128 has been a target for study due to its proximity and has been observed for many years."
"What future telescopes could observe Ross 128 b?","Next-generation telescopes like the Extremely Large Telescope may provide valuable data on Ross 128 b."
"What technological advancements are needed to study Ross 128 b further?","Advancements in spectroscopy and imaging techniques are necessary for detailed studies of Ross 128 b."
"What is the primary energy source for Ross 128 b?","The primary energy source for Ross 128 b is the radiation from its host star, Ross 128."
"What type of star is Ross 128?","Ross 128 is classified as a red dwarf star, specifically an M-type main-sequence star."
"What is the temperature range on Ross 128 b?","The temperature range on Ross 128 b could vary widely, but it is estimated to be between -60 and 20 degrees Celsius."
"Is there any evidence of water vapor on Ross 128 b?","As of now, there is no direct evidence of water vapor in the atmosphere of Ross 128 b."
"What scientific instruments can help study Ross 128 b's atmosphere?","Instruments like the James Webb Space Telescope and high-resolution spectrographs can aid in studying its atmosphere."
"How does Ross 128 b's size affect its potential habitability?","Being a super-Earth, Ross 128 b may have conditions suitable for habitability, but this is not guaranteed."
"What are the possible climatic conditions on Ross 128 b?","Possible climatic conditions include cold temperatures and varying weather patterns, but specifics remain unknown."
"How long does it take for light from Ross 128 to reach Earth?","It takes about 11 years for light from Ross 128 to reach Earth."
"What impact does Ross 128 b's proximity have on research?","Its proximity allows for more detailed observations and a better understanding of exoplanet atmospheres."
"Is there any known variability in Ross 128's brightness?","Ross 128 is known to have low variability in brightness compared to other stars, but some flaring events have been observed."
"What is the likelihood of discovering additional planets around Ross 128?","The likelihood is considered moderate, and future observations may reveal additional companions."
"How do scientists assess the potential for life on Ross 128 b?","Scientists assess the potential for life by analyzing factors such as temperature, atmospheric composition, and distance from its star."
"What are the potential biosignatures scientists look for on Ross 128 b?","Potential biosignatures include gases like oxygen, methane, and other indicators of biological processes."
"What role does Ross 128 b play in exoplanet cataloging?","Ross 128 b serves as an important case study in cataloging potentially habitable exoplanets."
"Are there any cultural references to Ross 128 b?","As a relatively newly discovered exoplanet, Ross 128 b has not yet made significant cultural impacts or references."
"What is the best time to observe Ross 128 b from Earth?","The best time to observe Ross 128 is typically during its peak visibility in the sky, often in winter months."
"How does Ross 128 b's mass influence its geological characteristics?","The mass of Ross 128 b could impact its geological activity and ability to retain an atmosphere."
"What challenges do astronomers face in characterizing Ross 128 b?","Challenges include its distance, the faintness of its host star, and the need for advanced observational techniques."
"What future technologies could enhance the study of Ross 128 b?","Future technologies like advanced adaptive optics and next-generation telescopes could enhance studies."
"What findings about Ross 128 b could change current understanding of exoplanets?","New findings may reshape the understanding of super-Earths, their atmospheres, and their potential for life."
"What is the name of the exoplanet orbiting Luyten's Star?","The exoplanet orbiting Luyten's Star is called Luyten b."
"How far is Luyten b from Earth?","Luyten b is approximately 12.2 light-years away from Earth."
"What type of star is Luyten's Star?","Luyten's Star is classified as a red dwarf star, specifically an M-type star."
"What is the estimated mass of Luyten b compared to Earth?","Luyten b has an estimated mass of about 2.9 times that of Earth."
"Is Luyten b located in the habitable zone?","Luyten b is located within the habitable zone of its star, making it a candidate for habitability."
"What is the orbital period of Luyten b?","The orbital period of Luyten b is about 5.7 days."
"What is the expected surface temperature of Luyten b?","The expected surface temperature of Luyten b is estimated to be around -30 degrees Celsius."
"Does Luyten b have any known moons?","As of now, no moons have been confirmed orbiting Luyten b."
"What are the primary scientific interests in Luyten b?","Primary interests include studying its potential habitability and atmospheric conditions."
"How was Luyten b discovered?","Luyten b was discovered using the radial velocity method, observing the star's wobble."
"What challenges exist in studying Luyten b?","Challenges include its distance and the faintness of Luyten's Star, which complicate observations."
"What is the composition of Luyten b?","The exact composition of Luyten b is not well known, but it is likely rocky."
"What is the distance of Luyten b from its host star?","Luyten b orbits at a distance of about 0.09 AU from Luyten's Star."
"Can Luyten b sustain liquid water?","If conditions allow for a stable atmosphere, Luyten b could potentially sustain liquid water."
"What is the significance of Luyten b in exoplanet research?","Luyten b is significant due to its proximity and potential for habitability."
"What is known about the atmosphere of Luyten b?","The atmospheric conditions of Luyten b are largely unknown and require further study."
"How does Luyten b compare to other known exoplanets?","Luyten b is larger than Earth and located at a moderate distance from its star compared to other exoplanets."
"What methods are used to detect Luyten b?","Radial velocity measurements and Doppler spectroscopy are used to detect Luyten b."
"What is the potential for discovering additional planets around Luyten's Star?","There is potential for discovering more planets, as further observations may reveal additional companions."
"How does the luminosity of Luyten's Star affect Luyten b?","The low luminosity results in colder temperatures on Luyten b compared to Earth."
"What future missions could study Luyten b?","Future missions like the James Webb Space Telescope may provide insights into Luyten b's atmosphere."
"What is the escape velocity of Luyten b?","The escape velocity of Luyten b is estimated to be around 7.1 km/s."
"What is the geological activity of Luyten b?","The geological activity of Luyten b is largely speculative and not well understood."
"Is Luyten b a tidally locked planet?","It is possible that Luyten b is tidally locked due to its close orbit to its star."
"What are the possible atmospheric components of Luyten b?","The possible atmospheric components are unknown but may include gases like carbon dioxide or nitrogen."
"What are the key features of Luyten b?","Key features include its size, proximity to Earth, and position within the habitable zone."
"Does Luyten b have a magnetic field?","As of now, it is unclear whether Luyten b has a significant magnetic field."
"What is the expected atmospheric pressure on Luyten b?","The expected atmospheric pressure on Luyten b is uncertain and requires further study."
"What are some potential biosignatures to look for on Luyten b?","Potential biosignatures include gases like oxygen, methane, and other indicators of biological processes."
"How does the radiation from Luyten's Star affect Luyten b?","Luyten's Star emits less radiation than the Sun, potentially allowing for a more stable atmosphere on Luyten b."
"What is the primary energy source for Luyten b?","The primary energy source for Luyten b is the radiation from its host star, Luyten's Star."
"What is the best time to observe Luyten b from Earth?","The best time to observe Luyten b is during the optimal visibility of Luyten's Star in the night sky."
"How does Luyten b's mass influence its potential habitability?","A larger mass may influence geological activity and the ability to retain an atmosphere."
"What challenges do astronomers face in characterizing Luyten b?","Challenges include its distance, the faintness of Luyten's Star, and limited observational data."
"What future technologies could enhance the study of Luyten b?","Future technologies like advanced adaptive optics and high-resolution spectrographs could enhance studies."
"What are the potential climatic conditions on Luyten b?","Potential climatic conditions could include cold temperatures and varying weather patterns."
"Is there any known variability in Luyten's Star's brightness?","Luyten's Star is relatively stable, with low variability in brightness."
"What role does Luyten b play in understanding super-Earths?","Luyten b serves as an important example for studying the characteristics and potential habitability of super-Earths."
"Can Luyten b be used to test theories of planetary formation?","Yes, studying Luyten b can help test theories related to the formation of super-Earths and planetary systems."
"What findings about Luyten b could change current understanding of exoplanets?","New findings may reshape the understanding of super-Earth atmospheres and their potential for life."
"What is the expected orbital eccentricity of Luyten b?","The expected orbital eccentricity of Luyten b is relatively low, suggesting a nearly circular orbit."
"What is the primary method used to discover Luyten b?","Luyten b was discovered using the radial velocity method, which detects the star's wobble."
"What is the significance of Luyten b's discovery in the context of exoplanet research?","Luyten b's discovery contributes to the understanding of potentially habitable planets around red dwarf stars."
"Are there any known variations in Luyten b's orbit?","As of now, there are no known significant variations in Luyten b's orbit."
"What is the anticipated surface composition of Luyten b?","The anticipated surface composition is likely rocky, similar to Earth."
"How does the temperature on Luyten b compare to that of Earth?","Luyten b is expected to be colder than Earth due to its proximity to a dimmer star."
"What is the potential for Luyten b to have an atmosphere?","Luyten b may have an atmosphere, but its composition and stability are not well known."
"Is Luyten b part of a multi-planet system?","Currently, Luyten b is the only confirmed planet in the Luyten's Star system."
"What are the implications of finding more planets around Luyten's Star?","Finding more planets could provide insights into planetary formation and habitability in red dwarf systems."
"What technologies are needed to further study Luyten b?","Technologies such as improved spectroscopy and space-based telescopes are needed for further study."
"How does the gravitational interaction with Luyten's Star affect Luyten b?","Gravitational interactions with Luyten's Star help determine Luyten b's orbit and potential atmospheric retention."
"What is the role of Luyten b in the search for extraterrestrial life?","Luyten b is a key candidate in the search for potentially habitable exoplanets."
"Are there any known features on Luyten b's surface?","No specific surface features have been identified due to limited observational data."
"What are the implications of Luyten b's proximity to Earth for future exploration?","Its proximity makes Luyten b an attractive target for future observational campaigns and potential exploration."
"How do stellar flares from Luyten's Star impact Luyten b?","Stellar flares may affect the atmosphere and surface conditions on Luyten b, impacting its habitability."
"What is the expected length of a day on Luyten b?","The expected length of a day on Luyten b is not well established but may be similar to its orbital period."
"How does the luminosity of Luyten's Star influence Luyten b's climate?","The low luminosity of Luyten's Star contributes to cooler temperatures on Luyten b."
"What future observations could help understand Luyten b better?","Future observations with advanced telescopes could provide data on Luyten b's atmosphere and potential for life."
"What is the expected atmospheric density of Luyten b?","The expected atmospheric density of Luyten b is uncertain and requires further research."
"What potential technologies could detect biosignatures on Luyten b?","Technologies like spectrographs and next-gen space telescopes could detect potential biosignatures."
"How does Luyten b compare to the Earth in terms of habitability potential?","While Luyten b is located in the habitable zone, its actual habitability potential remains uncertain and needs further study."
"What is the name of the exoplanet discovered around Teegarden's Star?","The exoplanet discovered around Teegarden's Star is called Teegarden b."
"How far is Teegarden b from Earth?","Teegarden b is approximately 12.5 light-years away from Earth."
"What type of star is Teegarden's Star?","Teegarden's Star is classified as a red dwarf star, specifically an M-type star."
"What is the estimated mass of Teegarden b compared to Earth?","Teegarden b has an estimated mass of about 1.1 times that of Earth."
"Is Teegarden b located in the habitable zone?","Yes, Teegarden b is located within the habitable zone of its star."
"What is the orbital period of Teegarden b?","The orbital period of Teegarden b is about 4.9 days."
"What is the expected surface temperature of Teegarden b?","The expected surface temperature of Teegarden b could range from -50 to 20 degrees Celsius."
"Does Teegarden b have any known moons?","As of now, there are no confirmed moons orbiting Teegarden b."
"What are the primary scientific interests in Teegarden b?","Primary interests include studying its potential habitability and atmospheric conditions."
"How was Teegarden b discovered?","Teegarden b was discovered using the radial velocity method, which detects the star's wobble."
"What challenges exist in studying Teegarden b?","Challenges include its distance and the faintness of Teegarden's Star, which complicates observations."
"What is the composition of Teegarden b?","The exact composition of Teegarden b is not well known, but it is likely rocky."
"What is the distance of Teegarden b from its host star?","Teegarden b orbits at a distance of about 0.03 AU from Teegarden's Star."
"Can Teegarden b sustain liquid water?","If conditions allow for a stable atmosphere, Teegarden b could potentially sustain liquid water."
"What is the significance of Teegarden b in exoplanet research?","Teegarden b is significant due to its proximity and potential for habitability."
"What is known about the atmosphere of Teegarden b?","The atmospheric conditions of Teegarden b are largely unknown and require further study."
"How does Teegarden b compare to other known exoplanets?","Teegarden b is similar to Earth in size and is located at a moderate distance from its star."
"What methods are used to detect Teegarden b?","Radial velocity measurements and Doppler spectroscopy are used to detect Teegarden b."
"What is the potential for discovering additional planets around Teegarden's Star?","There is potential for discovering more planets, as further observations may reveal additional companions."
"How does the luminosity of Teegarden's Star affect Teegarden b?","The low luminosity results in colder temperatures on Teegarden b compared to Earth."
"What future missions could study Teegarden b?","Future missions like the James Webb Space Telescope may provide insights into Teegarden b's atmosphere."
"What is the escape velocity of Teegarden b?","The escape velocity of Teegarden b is estimated to be around 7.2 km/s."
"What is the geological activity of Teegarden b?","The geological activity of Teegarden b is largely speculative and not well understood."
"Is Teegarden b a tidally locked planet?","It is possible that Teegarden b is tidally locked due to its close orbit to its star."
"What are the primary components of the atmosphere of Teegarden b?","The primary components of the atmosphere are unknown and require further study."
"What are some key features of Teegarden b?","Key features include its size, proximity to Earth, and location within the habitable zone."
"Does Teegarden b have a magnetic field?","As of now, it is unclear whether Teegarden b has a significant magnetic field."
"What is the expected atmospheric pressure on Teegarden b?","The expected atmospheric pressure on Teegarden b is uncertain and requires further research."
"What are some potential biosignatures to look for on Teegarden b?","Potential biosignatures include gases like oxygen, methane, and other indicators of biological processes."
"How does the radiation from Teegarden's Star affect Teegarden b?","Radiation from Teegarden's Star may impact the atmosphere and surface conditions on Teegarden b."
"What is the primary energy source for Teegarden b?","The primary energy source for Teegarden b is the radiation from its host star, Teegarden's Star."
"What is the best time to observe Teegarden b from Earth?","The best time to observe Teegarden b is when Teegarden's Star is optimally visible in the night sky."
"How does Teegarden b's mass influence its potential habitability?","A larger mass may influence geological activity and the ability to retain an atmosphere."
