Question,Answer
"What challenges do astronomers face in characterizing Teegarden b?","Challenges include its distance, the faintness of Teegarden's Star, and limited observational data."
"What future technologies could enhance the study of Teegarden b?","Future technologies like advanced adaptive optics and high-resolution spectrographs could enhance studies."
"What are the potential climatic conditions on Teegarden b?","Potential climatic conditions could include cold temperatures and varying weather patterns."
"Is there any known variability in Teegarden's Star's brightness?","Teegarden's Star is relatively stable, with low variability in brightness."
"What role does Teegarden b play in the search for extraterrestrial life?","Teegarden b is a key candidate in the search for potentially habitable exoplanets."
"Are there any known features on Teegarden b's surface?","No specific surface features have been identified due to limited observational data."
"What are the implications of Teegarden b's proximity to Earth for future exploration?","Its proximity makes Teegarden b an attractive target for future observational campaigns and potential exploration."
"What is the expected length of a day on Teegarden b?","The expected length of a day on Teegarden b is not well established but may be similar to its orbital period."
"How does the temperature on Teegarden b compare to that of Earth?","Teegarden b is expected to have a cooler average temperature than Earth due to its proximity to a dimmer star."
"What kind of telescopes can effectively study Teegarden b?","Ground-based telescopes equipped with adaptive optics and space telescopes can effectively study Teegarden b."
"What is the likelihood of discovering life on Teegarden b?","While the likelihood of discovering life on Teegarden b is uncertain, its position in the habitable zone makes it a candidate for further study."
"How does the composition of Teegarden b compare to that of Mars?","Teegarden b is likely rocky like Mars, but its exact composition is still unknown."
"What are the possible atmospheric conditions on Teegarden b?","The possible atmospheric conditions on Teegarden b are speculative, but it may have a thin or dense atmosphere."
"Is there potential for liquid water on Teegarden b?","If atmospheric conditions are favorable, there may be potential for liquid water on Teegarden b."
"What type of star system is Teegarden's Star part of?","Teegarden's Star is a single star system with at least two confirmed planets."
"What scientific missions have focused on Teegarden b?","As of now, no specific missions have been solely dedicated to studying Teegarden b."
"Can Teegarden b be observed with amateur telescopes?","Teegarden b is too faint to be observed with most amateur telescopes, but its star can be."
"What are the implications of finding Earth-like conditions on Teegarden b?","Finding Earth-like conditions on Teegarden b could provide insights into the prevalence of habitable worlds."
"What is the significance of Teegarden b's orbit?","Teegarden b's orbit within the habitable zone makes it significant for understanding exoplanet habitability."
"How could future missions impact the study of Teegarden b?","Future missions with advanced technology could provide valuable data on Teegarden b's atmosphere and surface conditions."
"What kind of observations would help characterize Teegarden b?","Spectroscopic observations could help characterize the atmosphere and potential biosignatures of Teegarden b."
"What are the possible geological features on Teegarden b?","The possible geological features could include mountains, valleys, and potentially even bodies of water."
"How does the stellar activity of Teegarden's Star affect Teegarden b?","Stellar activity could influence the atmospheric retention and climate of Teegarden b."
"What is the expected impact of solar flares on Teegarden b?","Solar flares may pose a risk to the atmosphere and any potential life forms on Teegarden b."
"What is the role of Teegarden b in the study of super-Earths?","Teegarden b provides a valuable case study for understanding the characteristics and habitability of super-Earths."
"How does the distance to Teegarden b impact research opportunities?","Its relatively close distance allows for more accessible observational studies compared to more distant exoplanets."
"What advancements in technology could improve our understanding of Teegarden b?","Advancements in imaging technology and spectroscopic analysis could greatly enhance our understanding of Teegarden b."
"What is the distance of Gliese 1061 d from Earth?","Gliese 1061 d is approximately 12.0 light-years away from Earth."
"What type of star is Gliese 1061?","Gliese 1061 is a red dwarf star, specifically an M-type star."
"What is the mass of Gliese 1061 d compared to Earth?","Gliese 1061 d has an estimated mass of about 1.5 times that of Earth."
"Is Gliese 1061 d located in the habitable zone?","Yes, Gliese 1061 d is located within the habitable zone of its star."
"What is the orbital period of Gliese 1061 d?","The orbital period of Gliese 1061 d is approximately 13.0 days."
"What is the expected surface temperature of Gliese 1061 d?","The expected surface temperature of Gliese 1061 d could range between -30 and 10 degrees Celsius."
"How was Gliese 1061 d discovered?","Gliese 1061 d was discovered using the radial velocity method, which measures the star's wobble."
"Does Gliese 1061 d have any known moons?","As of now, there are no confirmed moons orbiting Gliese 1061 d."
"What are the primary scientific interests in Gliese 1061 d?","Primary interests include studying its potential habitability and atmospheric conditions."
"What is the distance of Gliese 1061 d from its host star?","Gliese 1061 d orbits at a distance of about 0.08 AU from Gliese 1061."
"Can Gliese 1061 d sustain liquid water?","If conditions are suitable, Gliese 1061 d may be capable of sustaining liquid water."
"What is known about the atmosphere of Gliese 1061 d?","The atmospheric conditions of Gliese 1061 d are largely unknown and require further study."
"What is the composition of Gliese 1061 d?","The exact composition of Gliese 1061 d is not well known, but it is likely rocky."
"What are some key features of Gliese 1061 d?","Key features include its size, proximity to Earth, and position within the habitable zone."
"What is the escape velocity of Gliese 1061 d?","The escape velocity of Gliese 1061 d is estimated to be around 10.3 km/s."
"What are the potential climatic conditions on Gliese 1061 d?","Potential climatic conditions could include a range of temperatures and varying weather patterns."
"Is Gliese 1061 d a tidally locked planet?","It is possible that Gliese 1061 d is tidally locked due to its close orbit to its star."
"What are the implications of finding Earth-like conditions on Gliese 1061 d?","Finding Earth-like conditions could provide insights into the prevalence of habitable worlds around red dwarfs."
"How does the radiation from Gliese 1061 affect Gliese 1061 d?","Radiation from Gliese 1061 may impact the atmosphere and surface conditions on Gliese 1061 d."
"What future missions could study Gliese 1061 d?","Future missions like the James Webb Space Telescope may provide insights into Gliese 1061 d's atmosphere."
"What challenges exist in studying Gliese 1061 d?","Challenges include its distance and the faintness of Gliese 1061, which complicates observations."
"What is the geological activity of Gliese 1061 d?","The geological activity of Gliese 1061 d is largely speculative and not well understood."
"How does the temperature on Gliese 1061 d compare to that of Earth?","Gliese 1061 d is expected to have cooler average temperatures than Earth due to its orbit around a dim star."
"What kind of telescopes can effectively study Gliese 1061 d?","Ground-based telescopes with adaptive optics and space telescopes can effectively study Gliese 1061 d."
"What is the likelihood of discovering life on Gliese 1061 d?","The likelihood of discovering life on Gliese 1061 d is uncertain, but its position in the habitable zone makes it a candidate for further study."
"How does the composition of Gliese 1061 d compare to that of Venus?","Gliese 1061 d is likely rocky like Venus, but its exact composition is still unknown."
"What are the possible atmospheric conditions on Gliese 1061 d?","The possible atmospheric conditions on Gliese 1061 d are speculative, but it may have a thick atmosphere."
"Is there potential for liquid water on Gliese 1061 d?","If atmospheric conditions allow, Gliese 1061 d could potentially support liquid water."
"What type of star system is Gliese 1061 part of?","Gliese 1061 is a single star system with at least three confirmed planets."
"What scientific missions have focused on Gliese 1061 d?","As of now, no specific missions have been solely dedicated to studying Gliese 1061 d."
"Can Gliese 1061 d be observed with amateur telescopes?","Gliese 1061 d is too faint to be observed with most amateur telescopes, but its star can be."
"What are the implications of finding Earth-like conditions on Gliese 1061 d?","Finding Earth-like conditions on Gliese 1061 d could provide insights into the prevalence of habitable exoplanets."
"What is the significance of Gliese 1061 d's orbit?","Gliese 1061 d's orbit within the habitable zone makes it significant for understanding exoplanet habitability."
"How could future missions impact the study of Gliese 1061 d?","Future missions with advanced technology could provide valuable data on Gliese 1061 d's atmosphere and surface conditions."
"What kind of observations would help characterize Gliese 1061 d?","Spectroscopic observations could help characterize the atmosphere and potential biosignatures of Gliese 1061 d."
"What are the possible geological features on Gliese 1061 d?","The possible geological features could include mountains, valleys, and potentially even bodies of water."
"How does the stellar activity of Gliese 1061 affect Gliese 1061 d?","Stellar activity could influence the atmospheric retention and climate of Gliese 1061 d."
"What is the expected impact of solar flares on Gliese 1061 d?","Solar flares may pose a risk to the atmosphere and any potential life forms on Gliese 1061 d."
"What role does Gliese 1061 d play in the study of super-Earths?","Gliese 1061 d provides a valuable case study for understanding the characteristics and habitability of super-Earths."
"How does the distance to Gliese 1061 d impact research opportunities?","Its relatively close distance allows for more accessible observational studies compared to more distant exoplanets."
"What advancements in technology could improve our understanding of Gliese 1061 d?","Advancements in imaging technology and spectroscopic analysis could greatly enhance our understanding of Gliese 1061 d."
"What is the expected axial tilt of Gliese 1061 d?","The expected axial tilt of Gliese 1061 d is not well established and requires further study."
"What is the age of Gliese 1061?","Gliese 1061 is estimated to be around 12.5 billion years old."
"Does Gliese 1061 d experience seasons?","If Gliese 1061 d has an axial tilt, it may experience seasonal variations, but this is speculative."
"What is the primary energy source for Gliese 1061 d?","The primary energy source for Gliese 1061 d is the radiation from its host star, Gliese 1061."
"What are the potential biosignatures to look for on Gliese 1061 d?","Potential biosignatures include gases like oxygen, methane, and other indicators of biological processes."
"What challenges do astronomers face in characterizing Gliese 1061 d?","Challenges include its distance, the faintness of Gliese 1061, and limited observational data."
"What types of exoplanets are similar to Gliese 1061 d?","Similar exoplanets include other super-Earths located in the habitable zones of red dwarf stars."
"How does the mass of Gliese 1061 d influence its potential habitability?","A larger mass may influence geological activity and the ability to retain an atmosphere."
"What are the potential impacts of stellar flares on Gliese 1061 d's atmosphere?","Stellar flares could strip away the atmosphere over time, affecting habitability."
"How might future telescopes study Gliese 1061 d?","Future telescopes could use transit photometry and direct imaging to gather data on Gliese 1061 d."
"What is the likelihood of finding water vapor on Gliese 1061 d?","If Gliese 1061 d has a suitable atmosphere, there is a chance of detecting water vapor."
"What are the potential tectonic activities on Gliese 1061 d?","The potential for tectonic activity on Gliese 1061 d is uncertain and would require more data."
"How does Gliese 1061's luminosity affect Gliese 1061 d?","The lower luminosity of Gliese 1061 allows Gliese 1061 d to remain in the habitable zone at a closer distance."
"What is the significance of the Gliese 1061 system for astrobiology?","The Gliese 1061 system is significant for astrobiology due to its potential habitable planets."
"How might the atmosphere of Gliese 1061 d affect surface conditions?","The atmosphere of Gliese 1061 d could regulate temperatures and influence weather patterns."
"What is the best time to observe Gliese 1061 d from Earth?","The best time to observe Gliese 1061 d is when Gliese 1061 is prominently visible in the night sky."
"What kinds of compounds could indicate the presence of life on Gliese 1061 d?","Compounds like oxygen, methane, and carbon dioxide could indicate biological processes."
"How could gravitational interactions affect Gliese 1061 d?","Gravitational interactions with other planets in the system could influence Gliese 1061 d's orbit and stability."
"What advancements in spectroscopy could aid the study of Gliese 1061 d?","Advancements in high-resolution spectroscopy could enhance the detection of atmospheric components on Gliese 1061 d."
"What future missions could provide valuable data on Gliese 1061 d?","Missions like the James Webb Space Telescope could provide insights into Gliese 1061 d's atmosphere."
"What is the distance of YZ Ceti d from Earth?","YZ Ceti d is approximately 12.1 light-years away from Earth."
"What type of star is YZ Ceti?","YZ Ceti is a red dwarf star, classified as an M-type star."
"What is the mass of YZ Ceti d compared to Earth?","YZ Ceti d has an estimated mass of about 1.9 times that of Earth."
"Is YZ Ceti d located in the habitable zone?","Yes, YZ Ceti d is located within the habitable zone of its star."
"What is the orbital period of YZ Ceti d?","The orbital period of YZ Ceti d is approximately 2.0 days."
"What is the expected surface temperature of YZ Ceti d?","The expected surface temperature of YZ Ceti d could range between -20 and 10 degrees Celsius."
"How was YZ Ceti d discovered?","YZ Ceti d was discovered using the radial velocity method, which detects the gravitational pull of planets on their host star."
"Does YZ Ceti d have any known moons?","As of now, there are no confirmed moons orbiting YZ Ceti d."
"What are the primary scientific interests in YZ Ceti d?","Primary interests include studying its potential habitability and atmospheric conditions."
"What is the distance of YZ Ceti d from its host star?","YZ Ceti d orbits at a distance of about 0.03 AU from YZ Ceti."
"Can YZ Ceti d sustain liquid water?","If conditions are suitable, YZ Ceti d may be capable of sustaining liquid water."
"What is known about the atmosphere of YZ Ceti d?","The atmospheric conditions of YZ Ceti d are largely unknown and require further study."
"What is the composition of YZ Ceti d?","The exact composition of YZ Ceti d is not well known, but it is likely rocky."
"What are some key features of YZ Ceti d?","Key features include its size, proximity to Earth, and position within the habitable zone."
"What is the escape velocity of YZ Ceti d?","The escape velocity of YZ Ceti d is estimated to be around 11.2 km/s."
"What are the potential climatic conditions on YZ Ceti d?","Potential climatic conditions could include a range of temperatures and varying weather patterns."
"Is YZ Ceti d a tidally locked planet?","It is possible that YZ Ceti d is tidally locked due to its close orbit to its star."
"What are the implications of finding Earth-like conditions on YZ Ceti d?","Finding Earth-like conditions could provide insights into the prevalence of habitable worlds around red dwarfs."
"How does the radiation from YZ Ceti affect YZ Ceti d?","Radiation from YZ Ceti may impact the atmosphere and surface conditions on YZ Ceti d."
"What future missions could study YZ Ceti d?","Future missions like the James Webb Space Telescope may provide insights into YZ Ceti d's atmosphere."
"What challenges exist in studying YZ Ceti d?","Challenges include its distance and the faintness of YZ Ceti, which complicates observations."
"What is the geological activity of YZ Ceti d?","The geological activity of YZ Ceti d is largely speculative and not well understood."
"What is the age of YZ Ceti?","YZ Ceti is estimated to be around 6 billion years old."
"Does YZ Ceti d experience seasons?","If YZ Ceti d has an axial tilt, it may experience seasonal variations, but this is speculative."
"What is the primary energy source for YZ Ceti d?","The primary energy source for YZ Ceti d is the radiation from its host star, YZ Ceti."
"What are the potential biosignatures to look for on YZ Ceti d?","Potential biosignatures include gases like oxygen, methane, and other indicators of biological processes."
"What challenges do astronomers face in characterizing YZ Ceti d?","Challenges include its distance, the faintness of YZ Ceti, and limited observational data."
"What types of exoplanets are similar to YZ Ceti d?","Similar exoplanets include other super-Earths located in the habitable zones of red dwarf stars."
"How does the mass of YZ Ceti d influence its potential habitability?","A larger mass may influence geological activity and the ability to retain an atmosphere."
"What are the potential impacts of stellar flares on YZ Ceti d's atmosphere?","Stellar flares could strip away the atmosphere over time, affecting habitability."
"How might future missions study YZ Ceti d?","Future missions could use transit photometry and direct imaging to gather data on YZ Ceti d."
"What is the likelihood of finding water vapor on YZ Ceti d?","If YZ Ceti d has a suitable atmosphere, there is a chance of detecting water vapor."
"What are the potential tectonic activities on YZ Ceti d?","The potential for tectonic activity on YZ Ceti d is uncertain and would require more data."
"How does YZ Ceti's luminosity affect YZ Ceti d?","The lower luminosity of YZ Ceti allows YZ Ceti d to remain in the habitable zone at a closer distance."
"What is the significance of the YZ Ceti system for astrobiology?","The YZ Ceti system is significant for astrobiology due to its potential habitable planets."
"How might the atmosphere of YZ Ceti d affect surface conditions?","The atmosphere of YZ Ceti d could regulate temperatures and influence weather patterns."
"What is the best time to observe YZ Ceti d from Earth?","The best time to observe YZ Ceti d is when YZ Ceti is prominently visible in the night sky."
"What kinds of compounds could indicate the presence of life on YZ Ceti d?","Compounds like oxygen, methane, and carbon dioxide could indicate biological processes."
"How could gravitational interactions affect YZ Ceti d?","Gravitational interactions with other planets in the system could influence YZ Ceti d's orbit and stability."
"What advancements in spectroscopy could aid the study of YZ Ceti d?","Advancements in high-resolution spectroscopy could enhance the detection of atmospheric components on YZ Ceti d."
"What future missions could provide valuable data on YZ Ceti d?","Missions like the James Webb Space Telescope could provide insights into YZ Ceti d's atmosphere."
"What is the expected axial tilt of YZ Ceti d?","The expected axial tilt of YZ Ceti d is not well established and requires further study."
"What is the expected orbital eccentricity of YZ Ceti d?","The expected orbital eccentricity of YZ Ceti d is likely low, indicating a circular orbit."
"Is YZ Ceti d likely to have an atmosphere?","It is possible that YZ Ceti d has an atmosphere, but its composition is unknown."
"What role does tidal locking play for YZ Ceti d?","Tidal locking could result in one side of YZ Ceti d always facing its star, impacting climate and weather."
"What are the potential cloud formations on YZ Ceti d?","Potential cloud formations could include water vapor clouds if conditions permit."
"How does the stellar radiation from YZ Ceti impact YZ Ceti d?","Stellar radiation may affect atmospheric retention and surface conditions on YZ Ceti d."
"What are the implications of tidal interactions on YZ Ceti d?","Tidal interactions could influence geological activity and stability on YZ Ceti d."
"What kind of observational techniques could enhance studies of YZ Ceti d?","Techniques like transit photometry and radial velocity measurements could enhance studies of YZ Ceti d."
"How do the conditions on YZ Ceti d compare to those on Mars?","Conditions on YZ Ceti d may be more favorable for habitability than those on Mars, depending on its atmosphere."
"What types of research could benefit from studying YZ Ceti d?","Astrobiological research and planetary formation studies could benefit from studying YZ Ceti d."
"What is the likelihood of discovering extremophiles on YZ Ceti d?","If conditions are suitable, the likelihood of discovering extremophiles on YZ Ceti d could be significant."
"How might the composition of YZ Ceti d influence its climate?","The composition could determine the presence of greenhouse gases, affecting climate and temperatures."
"What are the possible implications of YZ Ceti d for future colonization?","Understanding YZ Ceti d's conditions could inform the potential for future colonization or habitation."
"What scientific instruments could provide data on YZ Ceti d's atmosphere?","Instruments like spectrometers and photometers could provide data on YZ Ceti d's atmosphere."
"How does YZ Ceti d contribute to the study of planetary habitability?","YZ Ceti d contributes valuable data points in understanding the conditions necessary for habitability."
"What are the potential impacts of solar activity on YZ Ceti d?","Solar activity could impact atmospheric retention and the potential for habitability on YZ Ceti d."
"What role does the mass of YZ Ceti d play in its geological features?","The mass may influence the planet's geological activity and ability to maintain an atmosphere."
"What are the potential atmospheric escape mechanisms for YZ Ceti d?","Atmospheric escape mechanisms could include thermal escape and hydrodynamic escape."
"How could interdisciplinary research enhance the study of YZ Ceti d?","Interdisciplinary research combining astronomy, geology, and biology could enhance the study of YZ Ceti d."
"What are the potential impacts of planetary neighbors on YZ Ceti d?","Planetary neighbors could influence gravitational stability and atmospheric retention on YZ Ceti d."
"What is the distance of Wolf 1061 c from Earth?","Wolf 1061 c is approximately 13.8 light-years away from Earth."
"What type of star is Wolf 1061?","Wolf 1061 is a red dwarf star, classified as an M-type star."
"What is the mass of Wolf 1061 c compared to Earth?","Wolf 1061 c has an estimated mass of about 4.3 times that of Earth."
"Is Wolf 1061 c located in the habitable zone?","Yes, Wolf 1061 c is located within the habitable zone of its star."
"What is the orbital period of Wolf 1061 c?","The orbital period of Wolf 1061 c is approximately 17.9 days."
"What is the expected surface temperature of Wolf 1061 c?","The expected surface temperature of Wolf 1061 c could range between 10 and 25 degrees Celsius."
"How was Wolf 1061 c discovered?","Wolf 1061 c was discovered using the radial velocity method, which detects the gravitational pull of planets on their host star."
"Does Wolf 1061 c have any known moons?","As of now, there are no confirmed moons orbiting Wolf 1061 c."
"What are the primary scientific interests in Wolf 1061 c?","Primary interests include studying its potential habitability and atmospheric conditions."
"What is the distance of Wolf 1061 c from its host star?","Wolf 1061 c orbits at a distance of about 0.073 AU from Wolf 1061."
"Can Wolf 1061 c sustain liquid water?","If conditions are suitable, Wolf 1061 c may be capable of sustaining liquid water."
"What is known about the atmosphere of Wolf 1061 c?","The atmospheric conditions of Wolf 1061 c are largely unknown and require further study."
"What is the composition of Wolf 1061 c?","The exact composition of Wolf 1061 c is not well known, but it is likely rocky."
"What are some key features of Wolf 1061 c?","Key features include its size, proximity to Earth, and position within the habitable zone."
"What is the escape velocity of Wolf 1061 c?","The escape velocity of Wolf 1061 c is estimated to be around 25.4 km/s."
"What are the potential climatic conditions on Wolf 1061 c?","Potential climatic conditions could include a range of temperatures and varying weather patterns."
"Is Wolf 1061 c a tidally locked planet?","It is possible that Wolf 1061 c is tidally locked due to its close orbit to its star."
"What are the implications of finding Earth-like conditions on Wolf 1061 c?","Finding Earth-like conditions could provide insights into the prevalence of habitable worlds around red dwarfs."
"How does the radiation from Wolf 1061 affect Wolf 1061 c?","Radiation from Wolf 1061 may impact the atmosphere and surface conditions on Wolf 1061 c."
"What future missions could study Wolf 1061 c?","Future missions like the James Webb Space Telescope may provide insights into Wolf 1061 c's atmosphere."
